Category,"name
(Parameter to be adjusted)","desc
(Parameter description)","get
(Command for querying parameter values.)","set
(Command for setting parameter values)",needrestart(Whether require restart or not),type (discrete/continuous),"options
(For the discrete type, use"";""to split  different values.)","dtype
(For discrete, the parameter value type can only be int or string.)","scope
(Minimum value of the parameter)","scope
(Maximum Value of the parameter)","step
(Step of the parameter value)","items
(Enumerated values out of parameter values. Use "";"" to split different values)",select (whether to select the parameter)
Kernel scheduling parameters,kernel.sched_migration_cost_ns,"This variable is used to determine whether a process is still hot. If the running time of a process is shorter than the value of this variable, the kernel considers that the code of the process is still in the cache. Therefore, the process is still hot and is not considered during migration.",sysctl -n @name,sysctl -w @name=$value,FALSE,discrete,,int,100000,5000000,100000,,yes
,kernel.sched_cfs_bandwidth_slice_us,Fixed size of the time slice applied for from the global time pool,sysctl -n @name,sysctl -w @name=$value,FALSE,discrete,,int,1000,50000,1000,,yes
,kernel.sched_wakeup_granularity_ns,"This variable indicates the base of the minimum time that a process should run after it is woken up. The smaller the base, the higher the probability of preemption.",sysctl -n @name,sysctl -w @name=$value,FALSE,discrete,,int,1000000,100000000,1000000,,yes
,kernel.sched_latency_ns,Maximum running time of a running process.,sysctl -n @name,sysctl -w @name=$value,FALSE,discrete,,int,1000000,100000000,1000000,,yes
,kernel.sched_nr_migrate,How Many Processes Can Be Moved to Another CPU at a Time When Load Balancing Is Performed in the Case of Multiple CPUs?,sysctl -n @name,sysctl -w @name=$value,FALSE,discrete,,int,1,128,1,,yes
,kernel.sched_min_granularity_ns,"Minimum running time of a process on the CPU. During this time, the kernel does not proactively select other processes for scheduling (in nanoseconds).",sysctl -n @name,sysctl -w @name=$value,FALSE,discrete,,int,1000000,100000000,1000000,,yes
,kernel.sched_tunable_scaling,"Update method used when the kernel attempts to adjust the values of sched_min_granularity, sched_latency, and sched_wakeup_granularity. The value 0 indicates that the value is not adjusted, and the value 1 indicates that the value is adjusted based on the number of CPUs, 2: The linear proportion is adjusted based on the number of CPUs.",sysctl -n @name,sysctl -w @name=$value,FALSE,discrete,0; 1; 2,string,,,,,yes
Network adapter parameters,transparent_hugepage.defrag,Enabling or Disabling Transparent Hugepages,cat /sys/kernel/mm/transparent_hugepage/defrag | sed -n 's/.*\[\(.*\)\].*/\1/p',echo $value > /sys/kernel/mm/transparent_hugepage/defrag,FALSE,discrete,always;defer;defer+madvise;madvise;never,string,,,,,yes
,transparent_hugepage.enabled,Enabling or Disabling Transparent Hugepages,cat /sys/kernel/mm/transparent_hugepage/enabled | sed -n 's/.*\[\(.*\)\].*/\1/p',echo $value > /sys/kernel/mm/transparent_hugepage/enabled,FALSE,discrete,always; madvise; never,string,,,,,yes
,net.netfilter.nf_conntrack_max,"Maximum number of tracing connections
When a container is used, the nf_conntrack module cannot be disabled. Therefore, kernel parameters related to nf_conntrack need to be added to the /etc/sysctl.conf file to prevent packet loss caused by full table records.",sysctl -n @name,sysctl -w @name=$value,FALSE,discrete,,int,0,67108864,1,,yes
,net.mtu,"Indicates the maximum transmission unit of the network,",ifconfig @netdev | grep mtu | awk '{print $4}',ifconfig @netdev mtu $value,FALSE,discrete,,int,500,9000,500,,yes
,net.tx-frames,Configuring NIC Interrupt Combination,ethtool -c @netdev | grep tx-frames: | awk '{print $2}',ethtool -C @netdev tx-frames $value,FALSE,discrete,,int,0,64,2,,yes
,net.rx-frames,Configuring NIC Interrupt Combination,ethtool -c @netdev | grep rx-frames: | awk '{print $2}',ethtool -C @netdev rx-frames $value,FALSE,discrete,,int,0,64,2,,yes
,net.tx-usecs,Configuring NIC Interrupt Combination,ethtool -c @netdev | grep tx-usecs: | awk '{print $2}',ethtool -C @netdev tx-usecs $value,FALSE,discrete,,int,2,64,2,,yes
,net.rx-usecs,Configuring NIC Interrupt Combination,ethtool -c @netdev | grep rx-usecs: | awk '{print $2}',ethtool -C @netdev rx-usecs $value,FALSE,discrete,,int,2,64,2,,yes
,net.combined,Set the length and number of NIC queues.,ethtool -l @netdev | grep Combined | awk '{print $2}' | tail -n 1,ethtool -L @netdev combined $value,FALSE,discrete,,int,1,32,1,,yes
,net.adaptive-rx,Sets whether to enable interrupt combination auto-sensing for a NIC.,ethtool -c @netdev | grep Adaptive | awk '{print $3}',ethtool -C @netdev adaptive-rx $value,FALSE,discrete,on; off,string,,,,,yes
,net.adaptive-tx,Sets whether to enable interrupt combination auto-sensing for a NIC.,ethtool -c @netdev | grep Adaptive | awk '{print $5}',ethtool -C @netdev adaptive-tx $value,FALSE,discrete,on; off,string,,,,,yes
,net.tx-ring buffer size,Indicates the ring buffer size of the NIC.,ethtool -g @netdev | tail -n 2 | head -n 1 | awk '{print $2}',ethtool -G @netdev tx $value,FALSE,discrete,,int,256,16384,256,,yes
,net.rx-ring buffer size,Indicates the ring buffer size of the NIC.,ethtool -g @netdev | tail -n 5 | head -n 1 | awk '{print $2}',ethtool -G @netdev rx $value,FALSE,discrete,,int,256,16384,256,,yes
,net.generic-receive-offload,Whether reassembling small packets into larger ones,"ethtool -k @netdev | grep ""generic-receive-offload"" | awk '{print $2}'",ethtool -K @netdev gro $value,FALSE,discrete,on;off,string,,,,,yes
,net.generic-segmentation-offload,Whether reassembling small packets into larger ones,"ethtool -k @netdev | grep ""generic-segmentation-offload"" | awk '{print $2}'",ethtool -K @netdev gso $value,FALSE,discrete,on;off,string,,,,,yes
,net.tcp-segmentation-offload,Wheth allow a device to segment a single frame into multiple frames with a data payload size specified in skb_shinfo()->gso_size.,"ethtool -k @netdev | grep ""tcp-segmentation-offload"" | awk '{print $2}'",ethtool -K @netdev tso $value,FALSE,discrete,on;off,string,,,,,yes
,sunrpc.tcp_slot_table_entries,"The Linux NFS client controls the number of concurrent NFS requests. If this parameter is set to a small value, the I/O performance is poor. By default, the maximum value of this parameter for the compiled kernel is 256. You can increase the value of this parameter to achieve better performance.",sysctl -n @name,sysctl -w @name=$value,FALSE,discrete,,int,4,256,4,,no
,sunrpc.udp_slot_table_entries,"The Linux NFS client controls the number of concurrent NFS requests. If this parameter is set to a small value, the I/O performance is poor. By default, the maximum value of this parameter for the compiled kernel is 256. You can increase the value of this parameter to achieve better performance.",sysctl -n @name,sysctl -w @name=$value,FALSE,discrete,,int,4,256,4,,no
Kernel resource parameters,kernel.pid_max,Maximum process ID.,sysctl -n @name,sysctl -w @name=$value,FALSE,discrete,,int,1048576,4194304,1048576,,yes
,kernel.shmmni,Maximum number of shared memory segments in the system.,sysctl -n @name,sysctl -w @name=$value,FALSE,discrete,,int,1024,16384,1024,,yes
,kernel.shmmax,"The maximum size, in bytes, of the shared memory segment allowed by the system.",sysctl -n @name,sysctl -w @name=$value,FALSE,discrete,,int,17179869184,68719476736,17179869184,,yes
,kernel.shmall,The total amount of shared memory available on the system in bytes,sysctl -n @name,sysctl -w @name=$value,FALSE,discrete,,int,1073741824,8589934592,1073741824,,yes
,kernel.core_uses_pid,"Whether to add the application pid to the core file name as an extension.
0: no
1: add",sysctl -n @name,sysctl -w @name=$value,FALSE,discrete,0; 1,string,,,,,yes
,kernel.msgmni,System Message Queue Length,sysctl -n @name,sysctl -w @name=$value,FALSE,discrete,,int,8000,128000,8000,,yes
,kernel.msgmax,Maximum number of bytes of a single message in a message queue.,sysctl -n @name,sysctl -w @name=$value,FALSE,discrete,,int,4096,1048576,4096,,yes
,kernel.msgmnb,Maximum length of bytes in a single message queue,sysctl -n @name,sysctl -w @name=$value,FALSE,discrete,,int,4096,1048576,4096,,yes
,kernel.sem,"The file contains four values:
1. Maximum number of signals of the same type (semmsl)
2. Maximum number of signals in the system, =semmni*semmsl (semmns)
3. Maximum number of operations (maximum number of semaphores that can be invoked) contained in each system invoking (semopm)
4. Maximum number of signal types in the system. A signal identifier represents a type (semmni).",sysctl -n @name,sysctl -w @name=$value,FALSE,discrete,16000 512000000 256 16000;32000 1024000000 500 32000;64000 2048000000 1000 64000,string,,,,,yes
,kernel.hung_task_timeout_secs,"Timeout interval of a hung_task (in seconds). When a process is in the TASK_UNINTERRUPTIBLE state for a period longer than the timeout interval, a hung_task occurs.",sysctl -n @name,sysctl -w @name=$value,FALSE,discrete,,int,30,1200,30,,yes
,kernel.nmi_watchdog,"Enabling nmi_watchdog
0: disabled
1: enabled",sysctl -n @name,sysctl -w @name=$value,FALSE,discrete,0; 1,string,,,,,yes
,kernel.sched_rt_runtime_us,"This parameter, together with sched_rt_period, determines the period of the real-time process.",sysctl -n @name,sysctl -w @name=$value,FALSE,discrete,,int,950000,1000000,10000,,yes
,kernel.timer_migration,Disable Clock Migration,sysctl -n @name,sysctl -w @name=$value,FALSE,discrete,0; 1,string,,,,,yes
,kernel.threads-max,Maximum number of processes (including threads) in the system,sysctl -n @name,sysctl -w @name=$value,FALSE,discrete,,int,655360,65536000,655360,,yes
,kernel.sysrq,"The file specifies a non-zero value, which activates the sysrq key on the keyboard.",sysctl -n @name,sysctl -w @name=$value,FALSE,discrete,0; 1,string,,,,,yes
,kernel.sched_autogroup_enabled,"When enabled, the kernel creates task groups to optimize desktop program scheduling.
0: disabled
1: enabled",sysctl -n @name,sysctl -w @name=$value,FALSE,discrete,0; 1,string,,,,,yes
,kernel.numa_balancing,Specifies whether to enable NUMA automatic balancing.,sysctl -n @name,sysctl -w @name=$value,FALSE,discrete,0; 1,string,,,,,yes
,kernel.randomize_va_space,Setting Memory Address Randomization,sysctl -n @name,sysctl -w @name=$value,FALSE,discrete,,int,0,2,1,,yes
,kernel.dmesg_restrict,"Which users are restricted from viewing syslogs?
0: no restriction
1: Only privileged users can view the information.",sysctl -n @name,sysctl -w @name=$value,FALSE,discrete,0;1,string,,,,,yes
Virtual memory and buffer/cache parameters,vm.swappiness,A larger value indicates that the swap partition is used more actively. A smaller value indicates that the memory is used more actively.,sysctl -n @name,sysctl -w @name=$value,FALSE,discrete,,int,0,100,1,,yes
,vm.vfs_cache_pressure,Indicates the tendency of the kernel to reclaim the memory used for directory and inode cache.,sysctl -n @name,sysctl -w @name=$value,FALSE,discrete,,int,0,500,50,,yes
,vm.dirty_background_ratio,"When the percentage of dirty pages reaches dirty_background_ratio, the write function wakes up the flusher thread of the kernel to write back dirty page data until the percentage is less than the value of dirty_background_ratio.",sysctl -n @name,sysctl -w @name=$value,FALSE,discrete,,int,0,100,1,,yes
,vm.dirty_ratio,The percentage of dirty data in the memory cannot exceed this value.,sysctl -n @name,sysctl -w @name=$value,FALSE,discrete,,int,0,100,1,,yes
,vm.stat_interval,VM information update frequency (in seconds),sysctl -n @name,sysctl -w @name=$value,FALSE,discrete,,int,1,100,1,,yes
,vm.dirty_expire_centisecs,"Expiration time of dirty data. When the flusher thread of the kernel is woken up after the expiration time, dirty data is written back to the disk. The unit is 1% second.",sysctl -n @name,sysctl -w @name=$value,FALSE,discrete,,int,100,1000,100,,yes
,vm.dirty_writeback_centisecs,Sets the interval for waking up the flusher kernel thread. This thread is used to write dirty pages back to the disk. The unit is 1% second.,sysctl -n @name,sysctl -w @name=$value,FALSE,discrete,,int,100,1000,100,,yes
,vm.overcommit_ratio,"When overcommit_memory is set to 2, the percentage of physical RAM that is considered is set.",sysctl -n @name,sysctl -w @name=$value,FALSE,discrete,,int,0,100,10,,yes
,vm.overcommit_memory,Indicates whether to allow excessive memory allocation. The process can allocate more memory than it actually uses.,sysctl -n @name,sysctl -w @name=$value,FALSE,discrete,0; 1,string,,,,,yes
,vm.min_free_kbytes,"Size of memory reserved in each memory area, in KB.",sysctl -n @name,sysctl -w @name=$value,FALSE,discrete,,int,10240,1024000,10240,,yes
,vm.page-cluster,Number of pages written to the swap partition each time.,sysctl -n @name,sysctl -w @name=$value,FALSE,discrete,,int,0,8,1,,yes
,vm.max_map_count,Defines the maximum memory area that a process can have.,sysctl -n @name,sysctl -w @name=$value,FALSE,discrete,,int,100000,10000000,100000,,yes
,vm.zone_reclaim_mode,This parameter is valid only when CONFIG_NUMA is enabled. zone_reclaim_mode is used to control how to reclaim memory when the memory domain OOM is enabled.,sysctl -n @name,sysctl -w @name=$value,FALSE,discrete,0; 1; 2; 4,string,,,,,yes
,vm.watermark_scale_factor,"Controls the radical degree of the kswapd process, that is, how much memory needs to be released for the system (NUMA node) from wakeup to hibernation.",sysctl -n @name,sysctl -w @name=$value,FALSE,discrete,,int,10,1000,10,,yes
,vm.numa_stat,"This command is used to set the data statistics during NUMA running. When the memory is insufficient, this command can be set to 0 to reduce the statistics precision.",sysctl -n @name,sysctl -w @name=$value,FALSE,discrete,0; 1,string,,,,,yes
,vm.drop_caches,Releases the cache. The cache is released each time the parameter is modified.,sysctl -n @name,sysctl -w @name=$value,FALSE,discrete,1; 2; 3,string,,,,,yes
File system parameters,fs.inotify.max_user_watches,Sets the number of processes for each user to run the inotifywait or inotifywatch command.,sysctl -n @name,sysctl -w @name=$value,FALSE,discrete,,int,4096,819200,4096,,yes
,fs.nr_open,Maximum number of file handles that can be concurrently opened by a process,sysctl -n @name,sysctl -w @name=$value,FALSE,discrete,,int,10240,1024000,10240,,yes
,fs.file-max,Number of file handles that can be opened by all processes in the system at the same time,sysctl -n @name,sysctl -w @name=$value,FALSE,discrete,,int,102400,10240000,102400,,yes
,fs.aio-max-nr,Maximum number of AIO requests,sysctl -n @name,sysctl -w @name=$value,FALSE,discrete,,int,102400,10240000,102400,,yes
,fs.inotify.max_user_instances,Maximum number of inotify instances that can be started by each user,sysctl -n @name,sysctl -w @name=$value,FALSE,discrete,,int,64,65535,64,,yes
,fs.suid_dumpable,"This value can be used to query and set the core dump mode for setuid or otherwise protected/tainted binaries.
0: default
1: debug
2: suidsafe",sysctl -n @name,sysctl -w @name=$value,FALSE,discrete,,int,0,2,1,,yes
Block storage device parameters,blockdev,Disk prefetch settings,/sbin/blockdev --getra /dev/@block,/sbin/blockdev --setra $value /dev/@block,FALSE,discrete,,int,0,2147483648,8,,yes
,block.low_latency,Enables (1) or disables (0) the low latency mode,cat /sys/block/@block/queue/iosched/low_latency,echo $value > /sys/block/@block/queue/iosched/low_latency,FALSE,discrete,0;1,string,,,,,no
,block.fifo_batch,"This parameter is valid only for the Deadline scheduling policy.
The number of read or write operations issued in a single batch. The default value is 16. The higher the value, the higher the throughput, but also increases the latency.",cat /sys/block/@block/queue/iosched/fifo_batch,echo $value > /sys/block/@block/queue/iosched/fifo_batch,FALSE,discrete,,int,1,128,1,,yes
,block.front_merges,"This parameter is valid only for the Deadline scheduling policy.
When a new request enters the queue, it can be merged if the requested sector is close to the current sector. The merge can be backward or forward. In some scenarios, forward merging is unnecessary. In this case, you can set this parameter to disable forward merging. By default, the deadline supports forward merging. If this parameter is set to 0, forward merging is disabled.",cat /sys/block/@block/queue/iosched/front_merges,echo $value > /sys/block/@block/queue/iosched/front_merges,FALSE,discrete,0;1,string,,,,,yes
,block.read_expire,"This parameter is valid only for the Deadline scheduling policy.
This parameter specifies the expiration time of a read request, in milliseconds.",cat /sys/block/@block/queue/iosched/read_expire,echo $value > /sys/block/@block/queue/iosched/read_expire,FALSE,discrete,,int,100,1000,100,,yes
,block.write_expire,"This parameter is valid only for the Deadline scheduling policy.
This parameter specifies the expiration time of a write request, in milliseconds.",cat /sys/block/@block/queue/iosched/write_expire,echo $value > /sys/block/@block/queue/iosched/write_expire,FALSE,discrete,,int,1000,5000,10000,,no
,block.writes_starved,"This parameter is valid only for the Deadline scheduling policy.
This parameter specifies the number of read requests that can be sent after the read and write queues are not empty. A larger value indicates a higher priority for read batch processing.",cat /sys/block/@block/queue/iosched/writes_starved,echo $value > /sys/block/@block/queue/iosched/writes_starved,FALSE,discrete,,int,1,10,1,,yes
,block.back_seek_max,"This parameter is valid only for the CFQ/BFQ scheduling policy.
Maximum range of backward addressing for the head",cat /sys/block/@block/queue/iosched/back_seek_max,echo $value > /sys/block/@block/queue/iosched/back_seek_max,FALSE,discrete,,int,4096,1048576,4096,,no
,block.back_seek_penalty,"This parameter is valid only for the CFQ/BFQ scheduling policy.
Penalty coefficient for backward addressing. This value is compared with forward addressing. The preceding two parameters are set to prevent slow addressing caused by head seek jitter.",cat /sys/block/@block/queue/iosched/back_seek_penalty,echo $value > /sys/block/@block/queue/iosched/back_seek_penalty,FALSE,discrete,,int,1,16,1,,no
,block.fifo_expire_async,"This parameter is valid only for the CFQ/BFQ scheduling policy.
Sets the timeout period of an asynchronous request. Synchronous requests and asynchronous requests are processed in different queues. During scheduling, the cfq process processes synchronous requests first and then asynchronous requests unless the asynchronous requests meet the preceding conditions.",cat /sys/block/@block/queue/iosched/fifo_expire_async,echo $value > /sys/block/@block/queue/iosched/fifo_expire_async,FALSE,discrete,,int,50,1000,50,,no
,block.fifo_expire_sync,"This parameter is valid only for the CFQ/BFQ scheduling policy.
Set the timeout period of the synchronization request.",cat /sys/block/@block/queue/iosched/fifo_expire_sync,echo $value > /sys/block/@block/queue/iosched/fifo_expire_sync,FALSE,discrete,,int,25,500,25,,no
,block.timeout_sync,"This parameter is valid only for the CFQ/BFQ scheduling policy.
The maximum time allocated to a device. When the addressing time of a device is long, increasing the time can improve the throughput.",cat /sys/block/@block/queue/iosched/timeout_sync,echo $value > /sys/block/@block/queue/iosched/timeout_sync,FALSE,discrete,,int,16,1024,16,,no
,block.max_budget,"This parameter is valid only for the CFQ/BFQ scheduling policy.
Maximum number of queue services that can be allocated to a queue",cat /sys/block/@block/queue/iosched/max_budget,echo $value > /sys/block/@block/queue/iosched/max_budget,FALSE,discrete,,int,0,0,0,,no
,block.slice_idle,"This parameter is valid only for the CFQ/BFQ scheduling policy.
A wait time is set. This allows the cfq to wait for a period of time before switching the cfq_queue or service tree to improve the throughput of the HDD.",cat /sys/block/@block/queue/iosched/slice_idle,echo $value > /sys/block/@block/queue/iosched/slice_idle,FALSE,discrete,,int,0,16,2,,no
,block.slice_idle_us,"This parameter is valid only for the CFQ/BFQ scheduling policy.
Waiting time, in microseconds.",cat /sys/block/@block/queue/iosched/slice_idle_us,echo $value > /sys/block/@block/queue/iosched/slice_idle_us,FALSE,discrete,,int,1000,16000,1000,,no
,block.strict_guarantees,"This parameter is valid only for the CFQ/BFQ scheduling policy.
When the request queue is empty, the request queue remains idle.",cat /sys/block/@block/queue/iosched/strict_guarantees,echo $value > /sys/block/@block/queue/iosched/strict_guarantees,FALSE,discrete,0;1,string,,,,,no
,block.read_lat_nsec,"This parameter is valid only for the Kyber scheduling policy.
Target delay of the read request, in ns.",cat /sys/block/@block/queue/iosched/read_lat_nsce,echo $value > /sys/block/@block/queue/iosched/read_lat_nsec,FALSE,discrete,,int,1000000,100000000,1000000,,no
,block.write_lat_nsec,"This parameter is valid only for the Kyber scheduling policy.
Target delay of a synchronous write request, in ns.",cat /sys/block/@block/queue/iosched/write_lat_nsec,echo $value > /sys/block/@block/queue/iosched/write_lat_nsec,FALSE,discrete,,int,2000000,100000000,2000000,,no
,block.io_poll_delay,"If polling is enabled, this parameter controls which type of polling is performed. The default value is -1, indicating traditional polling.
In this mode, the CPU will not give up any time to repeatedly ask for completion.
If set to 0, the mixed polling mode is used, and the kernel attempts to guess when the I/O is complete based on the training. Based on this guess, the kernel puts the process that made the IO request to sleep for a period of time before entering a traditional polling cycle. This mode may be slower than the purely traditional polling mode, but it may be more efficient. If this value is set to a value greater than 0, the kernel sets the process that issued the IO request to sleep for so many microseconds before entering a traditional poll.",cat /sys/block/@block/queue/io_poll_delay,echo $value > /sys/block/@block/queue/io_poll_delay,FALSE,discrete,0;-1,string,,,,,no
,block.io_poll,Whether to use polling or interrupt processing for block devices. The polling policy is preferred for NVMe SSD devices.,cat /sys/block/@block/queue/io_poll,echo $value > /sys/block/@block/queue/io_poll,FALSE,discrete,0; 1,string,,,,,no
,block.max_sectors_kb,Specifies the maximum size (in kilobytes) of the I/O request. The default value is 512 KB.,cat /sys/block/@block/queue/max_sectors_kb,echo $value > /sys/block/@block/queue/max_sectors_kb,FALSE,discrete,,int,64,1024,64,,yes
,block.queue_depth,Block device queue depth,cat /sys/block/@block/device/queue_depth,echo $value > /sys/block/@block/device/queue_depth,FALSE,discrete,,int,64,1024,64,,yes
,block.nr_requests,Limits the maximum number of read and write requests queued at the same time.,cat /sys/block/@block/queue/nr_requests,echo $value > /sys/block/@block/queue/nr_requests,FALSE,discrete,,int,128,2048,64,,yes
,block.read_ahead_kb,Defines the number of kilobytes that the operating system will prefetch during the sequential read operation phase to store information that may be needed immediately in the page cache.,cat /sys/block/@block/queue/read_ahead_kb,echo $value > /sys/block/@block/queue/read_ahead_kb,FALSE,discrete,,int,0,65536,1024,,yes
,block.rq_affinity,Whether I/O can be performed on different processors is not limited to the processor that sends the I/O request.,cat /sys/block/@block/queue/rq_affinity,echo $value > /sys/block/@block/queue/rq_affinity,FALSE,discrete,0; 1; 2,string,,,,,yes
,block.add_random,Some I/O events affect the entropy pool of /dev/random.,cat /sys/block/@block/queue/add_random,echo $value > /sys/block/@block/queue/add_random,FALSE,discrete,0; 1,string,,,,,yes
,block.rotational,"Whether the storage device is a mechanical hard disk. If the storage device is a solid state disk, set this parameter to 0.",cat /sys/block/@block/queue/rotational,echo $value > /sys/block/@block/queue/rotational,FALSE,discrete,0; 1,string,,,,,yes
,block.scheduler,Configure I/O scheduling. Deadline or noop is more suitable for MySQL database scenarios.,cat /sys/block/@block/queue/scheduler | sed -n 's/.*\[\(.*\)\].*/\1/p',echo $value > /sys/block/@block/queue/scheduler,FALSE,discrete,mq-deadline; kyber; bfq; none,string,,,,,yes
,block.write_cache,Whether to use the write back or write through cache policy,cat /sys/block/@block/queue/write_cache,echo $value > /sys/block/@block/queue/write_cache,FALSE,discrete,write back; write through,string,,,,,yes
,block.nomerges,"Most workloads benefit from request merges. However, disabling merges helps for debugging purposes. You can set this parameter to 0 to disable combination. Enabled by default (set to 1).",cat /sys/block/@block/queue/nomerges,echo $value > /sys/block/@block/queue/nomerges,FALSE,discrete,0; 1; 2,string,,,,,yes
Parameters related to the network software stack,net.core.netdev_budget,Number of network packets processed in each software interrupt,sysctl -n @name,sysctl -w @name=$value,FALSE,discrete,,int,100,1000,100,,yes
,net.core.optmem_max,Maximum size of the buffer allowed by each socket(in bytes). ,sysctl -n @name,sysctl -w @name=$value,FALSE,discrete,,int,20480,204800,20480,,yes
,net.core.wmem_max,"The maximum size of the system socket write buffer is increased to prevent buffer overflow caused by a large number of new connections. As a result, connections cannot be established. 
The default value is 229376. You are advised to change the value to 16777216. ",sysctl -n @name,sysctl -w @name=$value,FALSE,discrete,,int,1048576,67108864,1048576,,yes
